{
  "$schema": "http://json-schema.org/draft-07/schema#",
  "type": "object",
  "properties": {
    "id": {
      "type": "string",
      "description": "Primary key that uniquely identifies this profile"
    },
    "timestamp": {
      "type": "number",
      "description": "Event timestamp in seconds"
    },
    "event_properties": {
      "type": "object",
      "description": "Event properties, can include identifiers and extra properties"
    },
    "datetime": {
      "type": "string",
      "format": "date-time",
      "description": "Event timestamp in ISO8601 format (YYYY-MM-DDTHH:MM:SS+hh:mm)"
    },
    "uuid": {
      "type": "string",
      "description": "A unique identifier for the event, this can be used as a cursor in pagination"
    },
    "metric_id": {
      "type": ["string", "null"]
    },
    "profile_id": {
      "type": ["string", "null"]
    },
    "account_id": {
      "type": "string"
    }
  }
}
